{
  "report_title": "AI行业情报",
  "report_date": "2026-04-05",
  "time_window_hours": 48,
  "generated_at": "2026-04-05T09:00:00+08:00",
  "groups": [
    {
      "category": "AI Agent",
      "summary": "本组聚焦 Agent 工具、任务执行和工作流编排能力的更新。",
      "items": [
        {
          "title": "OpenAI 发布新 Agent 工具",
          "published_at": "2026-04-05 09:00",
          "source_name": "OpenAI Blog",
          "source_url": "https://example.com/openai-agent",
          "subject": "OpenAI",
          "classification": "AI Agent",
          "event_summary": "OpenAI 发布新的 Agent 工具，强调多步骤任务执行和工具调用。",
          "why_it_matters": "说明头部企业继续推进 Agent 从演示能力向执行能力演进。",
          "confidence": "high",
          "related_focus": "AI Agent / 头部 AI 企业",
          "within_48h": true,
          "status": "confirmed",
          "notes": "后续需确认是否开放 API。",
          "source_tier": "tier1"
        }
      ]
    },
    {
      "category": "AI Coding",
      "summary": "本组聚焦编码助手、IDE 集成与开发者工作流更新。",
      "items": [
        {
          "title": "GitHub Copilot 加强 IDE 集成",
          "published_at": "2026-04-05 08:10",
          "source_name": "GitHub Blog",
          "source_url": "https://example.com/github-copilot",
          "subject": "GitHub / Microsoft",
          "classification": "AI Coding",
          "event_summary": "GitHub Copilot 进一步增强 IDE 内部的代码生成与上下文理解。",
          "why_it_matters": "说明 AI Coding 仍是开发者入口和高频使用场景。",
          "confidence": "high",
          "related_focus": "AI Coding / 开发者生态",
          "within_48h": true,
          "status": "confirmed",
          "source_tier": "tier1"
        }
      ]
    },
    {
      "category": "头部 AI 企业",
      "summary": "本组聚焦头部企业的发布、策略与基础设施动作。",
      "items": [
        {
          "title": "Google DeepMind 发布新基准结果",
          "published_at": "2026-04-04 21:00",
          "source_name": "Google DeepMind Blog",
          "source_url": "https://example.com/deepmind-benchmark",
          "subject": "Google DeepMind",
          "classification": "模型与基础设施",
          "event_summary": "Google DeepMind 发布新的 benchmark 结果，强调推理与多步骤任务表现。",
          "why_it_matters": "表明模型竞争仍集中在能力和推理质量。",
          "confidence": "high",
          "related_focus": "模型 / 基础设施",
          "within_48h": true,
          "status": "confirmed",
          "source_tier": "tier1"
        }
      ]
    },
    {
      "category": "AI 领袖人物",
      "summary": "本组聚焦领袖人物的公开表态、观点变化和战略信号。",
      "items": [
        {
          "title": "某 CEO 在播客中强调 Agent 方向",
          "published_at": "2026-04-04 19:20",
          "source_name": "Podcast Transcript",
          "source_url": "https://example.com/podcast-ai-ceo",
          "subject": "某 AI 企业 CEO",
          "classification": "AI 领袖人物",
          "event_summary": "该 CEO 在访谈中强调 Agent 将成为下一阶段产品重点。",
          "why_it_matters": "领袖表态通常会影响产品路线和组织投入。",
          "confidence": "medium",
          "related_focus": "AI 领袖人物 / AI Agent",
          "within_48h": true,
          "status": "tentative",
          "notes": "需用原始转写交叉确认。",
          "source_tier": "tier2"
        }
      ]
    },
    {
      "category": "模型与基础设施",
      "summary": "本组聚焦模型、推理、部署和基础设施变化。",
      "items": [
        {
          "title": "NVIDIA 更新推理优化方案",
          "published_at": "2026-04-04 17:40",
          "source_name": "NVIDIA Blog",
          "source_url": "https://example.com/nvidia-inference",
          "subject": "NVIDIA",
          "classification": "模型与基础设施",
          "event_summary": "NVIDIA 公布新的推理优化方案，强调降低延迟和成本。",
          "why_it_matters": "基础设施优化直接影响模型部署和产品落地成本。",
          "confidence": "high",
          "related_focus": "模型 / 基础设施",
          "within_48h": true,
          "status": "confirmed",
          "source_tier": "tier1"
        }
      ]
    },
    {
      "category": "开源生态",
      "summary": "本组聚焦开源仓库、模型和 SDK 更新。",
      "items": [
        {
          "title": "Hugging Face 发布新开源模型仓库",
          "published_at": "2026-04-04 15:10",
          "source_name": "Hugging Face",
          "source_url": "https://example.com/huggingface-release",
          "subject": "Hugging Face",
          "classification": "开源生态",
          "event_summary": "Hugging Face 新增模型仓库并更新开发者工具链。",
          "why_it_matters": "开源生态仍是模型传播和开发者采用的重要通道。",
          "confidence": "medium",
          "related_focus": "开源生态",
          "within_48h": true,
          "status": "confirmed",
          "source_tier": "tier1"
        }
      ]
    },
    {
      "category": "政策与监管",
      "summary": "本组聚焦政策、监管和合规变化。",
      "items": [
        {
          "title": "欧盟更新 AI 合规指引",
          "published_at": "2026-04-04 13:30",
          "source_name": "EU Commission",
          "source_url": "https://example.com/eu-ai-guidance",
          "subject": "欧盟",
          "classification": "政策与监管",
          "event_summary": "欧盟更新 AI 合规指引，强调透明度与风险分级。",
          "why_it_matters": "监管变化会影响模型发布、产品设计和商业化节奏。",
          "confidence": "high",
          "related_focus": "政策 / 监管",
          "within_48h": true,
          "status": "confirmed",
          "source_tier": "tier1"
        }
      ]
    },
    {
      "category": "待确认线索",
      "summary": "本组聚焦当前无法确认发布时间、来源或主体的线索。",
      "items": [
        {
          "title": "某公司疑似发布 Agent 新功能",
          "published_at": "2026-04-05 07:50",
          "source_name": "社交媒体转述",
          "source_url": "https://example.com/tentative-agent",
          "subject": "某 AI 公司",
          "classification": "待确认线索",
          "event_summary": "社交媒体传出某公司疑似发布新的 Agent 功能。",
          "why_it_matters": "可能指向产品更新，但尚未确认。",
          "confidence": "low",
          "related_focus": "AI Agent",
          "within_48h": true,
          "status": "tentative",
          "notes": "需等待官方确认。",
          "source_tier": "tier3"
        }
      ]
    }
  ]
}
