{
  "report_title": "AI行业情报",
  "report_date": "2026-04-05",
  "time_window_hours": 48,
  "generated_at": "2026-04-05T09:00:00+08:00",
  "groups": [
    {
      "category": "AI Agent",
      "summary": "本组聚焦 Agent 工具、任务执行和工作流编排能力的更新。",
      "items": [
        {
          "title": "请替换为真实事件标题",
          "published_at": "2026-04-05 09:00",
          "source_name": "请替换为真实来源",
          "source_url": "https://example.com",
          "subject": "请替换为真实主体",
          "classification": "AI Agent",
          "event_summary": "请用一句话描述真实事件。",
          "why_it_matters": "请说明它为什么重要。",
          "confidence": "high",
          "related_focus": "AI Agent / 头部 AI 企业",
          "within_48h": true,
          "status": "confirmed",
          "notes": "请补充待确认点或备注。",
          "source_tier": "tier1"
        }
      ]
    },
    {
      "category": "AI Coding",
      "summary": "本组聚焦编码助手、IDE 集成与开发者工作流更新。",
      "items": []
    },
    {
      "category": "头部 AI 企业",
      "summary": "本组聚焦头部企业的发布、策略与基础设施动作。",
      "items": []
    },
    {
      "category": "AI 领袖人物",
      "summary": "本组聚焦领袖人物的公开表态、观点变化和战略信号。",
      "items": []
    },
    {
      "category": "模型与基础设施",
      "summary": "本组聚焦模型、推理、部署和基础设施变化。",
      "items": []
    },
    {
      "category": "开源生态",
      "summary": "本组聚焦开源仓库、模型和 SDK 更新。",
      "items": []
    },
    {
      "category": "政策与监管",
      "summary": "本组聚焦政策、监管和合规变化。",
      "items": []
    },
    {
      "category": "待确认线索",
      "summary": "本组聚焦当前无法确认发布时间、来源或主体的线索。",
      "items": []
    }
  ]
}
